{"attribution":"SABR Lahman (CC BY-SA 3.0); M7A experimental model-derived prices. See docs/DATA_ATTRIBUTION.md.","contextId":"context:37967c8929f1d6369202a1d3f9635f81381fe4ce15ce0e9dab71ac24b3c19174","datasetId":"dataset:1fba260824fe05abec3c5950cd184caa0d314b41f1253bc782f97b678bb28add","eligibilityPolicy":"observed-10-universal-dh-v1","id":"draft-catalog:95602e268bcd87ff6f5640525e3cfc1936eff28ae57a3d715a2f990ba689f9f8","players":[{"games":{"1B":0,"2B":0,"3B":0,"C":0,"CF":0,"DH":0,"LF":0,"RF":0,"SS":136},"id":"lahman:abramcj01","name":"CJ Abrams","pa":602,"positions":["SS","DH"],"price":9,"profileId":"prepared:8772aea71e913b3bc140de77d83e672b78fa8328159e200a8dd1a56e1b6b03c1"},{"games":{"1B":35,"2B":0,"3B":0,"C":0,"CF":0,"DH":0,"LF":0,"RF":0,"SS":0},"id":"lahman:abreujo02","name":"Jose Abreu","pa":120,"positions":["1B","DH"],"price":4,"profileId":"prepared:518a5ec7229286265e22e2ab9e024ae59cc5f05a197ed989db2c67dea9ad8e12"},{"games":{"1B":0,"2B":0,"3B":0,"C":0,"CF":1,"DH":1,"LF":5,"RF":125,"SS":0},"id":"lahman:abreuwi02","name":"Wilyer Abreu","pa":447,"positions":["RF","DH"],"price":10,"profileId":"prepared:505c37c4ac08bd2be05a08bacd5b7bfa11ada67da57381bad6f4325d9cae4acb"},{"games":{"1B":0,"2B":0,"3B":0,"C":0,"CF":0,"DH":0,"LF":0,"RF":48,"SS":0},"id":"lahman:acunaro01","name":"Ronald Acuña","pa":222,"positions":["RF","DH"],"price":8,"profileId":"prepared:fccaba986b9abe679ed09e15ceadd5a6e4caa5d7bcfaf86f99cae7097b12d109"},{"games":{"1B":0,"2B":0,"3B":0,"C":0,"CF":0,"DH":0,"LF":0,"RF":0,"SS":161},"id":"lahman:adamewi01","name":"Willy Adames","pa":688,"positions":["SS","DH"],"price":12,"profileId":"prepared:6c244cba7cd81ad7ecf7925e5b11bf8d298fc0a98c1a300ead2041bf5317e1f9"},{"games":{"1B":0,"2B":0,"3B":0,"C":40,"CF":0,"DH":1,"LF":0,"RF":0,"SS":0},"id":"lahman:adamsri03","name":"Riley Adams","pa":130,"positions":["C","DH"],"price":7,"profileId":"prepared:d217a8046f9ed3fb1fa2d60de198c84407bc17a376e066812099531644a9bf5b"},{"games":{"1B":0,"2B":0,"3B":0,"C":0,"CF":4,"DH":4,"LF":0,"RF":119,"SS":0},"id":"lahman:adelljo01","name":"Jo Adell","pa":450,"positions":["RF","DH"],"price":7,"profileId":"prepared:794fe04d42cbf79db2bc775e1b0c77bb785d4a2183329683096a2ea349b0b824"},{"games":{"1B":0,"2B":1,"3B":0,"C":0,"CF":0,"DH":0,"LF":0,"RF":0,"SS":68},"id":"lahman:ahmedni01","name":"Nick Ahmed","pa":228,"positions":["SS","DH"],"price":5,"profileId":"prepared:25cf56be8b403beafc42ae2110503202d5d5ba264025242f9377e795be631e62"},{"games":{"1B":0,"2B":99,"3B":0,"C":0,"CF":0,"DH":0,"LF":0,"RF":0,"SS":0},"id":"lahman:albieoz01","name":"Ozzie Albies","pa":435,"positions":["2B","DH"],"price":8,"profileId":"prepared:1e51b4987e0fc88bb1c8b6855c37e858e7ee97810e3143a834c996a44e6f6515"},{"games":{"1B":0,"2B":17,"3B":8,"C":0,"CF":0,"DH":16,"LF":0,"RF":0,"SS":20},"id":"lahman:alexabl01","name":"Blaze Alexander","pa":185,"positions":["2B","SS","DH"],"price":7,"profileId":"prepared:d58b20d0f27c1b9ab0d7e3a1c9aa6fd3ae6fd03240b6736a780f51b5b4ef05e8"},{"games":{"1B":0,"2B":2,"3B":5,"C":0,"CF":0,"DH":0,"LF":0,"RF":0,"SS":34},"id":"lahman:allenni02","name":"Nick Allen","pa":105,"positions":["SS","DH"],"price":4,"profileId":"prepared:d320d08346981ddc1d0674b1662072c665bfdbcd44b85ee6ca6c03fd1b497dfc"},{"games":{"1B":161,"2B":0,"3B":0,"C":0,"CF":0,"DH":1,"LF":0,"RF":0,"SS":0},"id":"lahman:alonspe01","name":"Pete Alonso","pa":695,"positions":["1B","DH"],"price":11,"profileId":"prepared:734c787c7259707e3a7b0aa1646c1390319272dab92e68f4570a4d039a57ea7c"},{"games":{"1B":0,"2B":147,"3B":0,"C":0,"CF":0,"DH":5,"LF":0,"RF":0,"SS":0},"id":"lahman:altuvjo01","name":"Jose Altuve","pa":682,"positions":["2B","DH"],"price":12,"profileId":"prepared:9242934859d80d330cfa594156b794f2e0691c6d8cda03946d6df45d97c12e05"},{"games":{"1B":0,"2B":0,"3B":0,"C":96,"CF":0,"DH":3,"LF":0,"RF":0,"SS":0},"id":"lahman:alvarfr01","name":"Francisco Alvarez","pa":342,"positions":["C","DH"],"price":8,"profileId":"prepared:f8b441fe6a33ea10bda0b4aed54904606d659537d382f8a86907834addf71c2d"},{"games":{"1B":0,"2B":0,"3B":0,"C":0,"CF":0,"DH":94,"LF":53,"RF":0,"SS":0},"id":"lahman:alvaryo01","name":"Yordan Alvarez","pa":635,"positions":["LF","DH"],"price":17,"profileId":"prepared:9f4ef758baf1f7857b76aff1894e4ccef1d1ae677be5b9f2ce036372328bfd83"},{"games":{"1B":0,"2B":1,"3B":0,"C":0,"CF":0,"DH":0,"LF":0,"RF":0,"SS":23},"id":"lahman:amayaja01","name":"Jacob Amaya","pa":72,"positions":["SS","DH"],"price":5,"profileId":"prepared:b4bd069a7d5a0dec812519c94d519b7c4b45922552e3e3b4f4912567b2843890"},{"games":{"1B":0,"2B":0,"3B":0,"C":116,"CF":0,"DH":0,"LF":0,"RF":0,"SS":0},"id":"lahman:amayami01","name":"Miguel Amaya","pa":363,"positions":["C","DH"],"price":6,"profileId":"prepared:505322ae59199d6f1ac44321c89cb1e7e6e121686876cf38c0068a96a8a4135b"},{"games":{"1B":0,"2B":0,"3B":0,"C":0,"CF":0,"DH":0,"LF":0,"RF":0,"SS":63},"id":"lahman:anderti01","name":"Tim Anderson","pa":241,"positions":["SS","DH"],"price":2,"profileId":"prepared:c25c87b84d91662f0370aac108283306058e8c3ef72b2d32093c5d95d14992c2"},{"games":{"1B":1,"2B":0,"3B":0,"C":0,"CF":0,"DH":3,"LF":72,"RF":0,"SS":0},"id":"lahman:andujmi01","name":"Miguel Andujar","pa":319,"positions":["LF","DH"],"price":7,"profileId":"prepared:c465127e3e80879ee818f2f1ade6d31838bc6b2fa3b3ae178a7d5ef91d8692d4"},{"games":{"1B":23,"2B":6,"3B":1,"C":0,"CF":0,"DH":10,"LF":0,"RF":0,"SS":0},"id":"lahman:arandjo01","name":"Jonathan Aranda","pa":143,"positions":["1B","DH"],"price":9,"profileId":"prepared:7bf9b846d76075cb0e43030535599253136c2aac66fc173b57385f5203b2eda6"},{"games":{"1B":0,"2B":0,"3B":0,"C":0,"CF":0,"DH":0,"LF":0,"RF":0,"SS":157},"id":"lahman:arciaor01","name":"Orlando Arcia","pa":602,"positions":["SS","DH"],"price":6,"profileId":"prepared:2bc7aca996ad581b569533cc5039ad2b6044a946a3846235c5d1de861395469c"},{"games":{"1B":0,"2B":0,"3B":146,"C":0,"CF":0,"DH":6,"LF":0,"RF":0,"SS":0},"id":"lahman:arenano01","name":"Nolan Arenado","pa":634,"positions":["3B","DH"],"price":10,"profileId":"prepared:e6bc69adc6257c024874fbfcb6516f2e4f736355c6abe78695980923e0b6d15a"},{"games":{"1B":4,"2B":6,"3B":20,"C":0,"CF":4,"DH":3,"LF":2,"RF":2,"SS":15},"id":"lahman:ariasga01","name":"Gabriel Arias","pa":161,"positions":["3B","SS","DH"],"price":6,"profileId":"prepared:5443d43adf452947916743666b6fea3cda46c80cd4112bb2811f3556784d8922"},{"games":{"1B":0,"2B":0,"3B":0,"C":0,"CF":9,"DH":7,"LF":140,"RF":0,"SS":0},"id":"lahman:arozara01","name":"Randy Arozarena","pa":648,"positions":["LF","DH"],"price":10,"profileId":"prepared:416a0624ac1253a6d8e4a951ae21f0598ff010ded668ee4af9833ed102fb5fa0"},{"games":{"1B":69,"2B":42,"3B":0,"C":0,"CF":0,"DH":47,"LF":0,"RF":0,"SS":0},"id":"lahman:arraelu01","name":"Luis Arraez","pa":672,"positions":["1B","2B","DH"],"price":8,"profileId":"prepared:e0e6dd588f0cd61631cfd47a058c3933f077948ac7d393a4e9d43c8720affbff"},{"games":{"1B":0,"2B":0,"3B":0,"C":0,"CF":11,"DH":2,"LF":45,"RF":5,"SS":0},"id":"lahman:azocajo01","name":"Jose Azocar","pa":79,"positions":["LF","CF","DH"],"price":6,"profileId":"prepared:7ee5294449601a69f299e956ae26530a96a7e864e9a58162049c8dc994231d3c"},{"games":{"1B":0,"2B":0,"3B":0,"C":0,"CF":5,"DH":0,"LF":21,"RF":4,"SS":0},"id":"lahman:baddoak01","name":"Akil Baddoo","pa":82,"positions":["LF","DH"],"price":6,"profileId":"prepared:469d5c4ae95007152bf853c421310f4c285faf8a6a6d1743989aaccccb853e71"},{"games":{"1B":0,"2B":0,"3B":0,"C":0,"CF":140,"DH":1,"LF":0,"RF":0,"SS":0},"id":"lahman:baderha01","name":"Harrison Bader","pa":437,"positions":["CF","DH"],"price":7,"profileId":"prepared:d296cf7a0c033f12484a99d80c68e417afe2b88e8e8231d0424a2e258c522b8e"},{"games":{"1B":0,"2B":1,"3B":0,"C":0,"CF":15,"DH":4,"LF":0,"RF":12,"SS":0},"id":"lahman:baeji01","name":"Ji Hwan Bae","pa":81,"positions":["CF","RF","DH"],"price":5,"profileId":"prepared:eb8d2324aaae3bdfdac6c72980af5c708c4386dbbcd4a5f16d74c56de09a2a31"},{"games":{"1B":0,"2B":0,"3B":0,"C":0,"CF":0,"DH":0,"LF":0,"RF":0,"SS":80},"id":"lahman:baezja01","name":"Javier Baez","pa":289,"positions":["SS","DH"],"price":4,"profileId":"prepared:68158287bd182d559bff7fbdcdfc85d7ccb16c4ccfbe294dcc6b03e8e75f2e1a"},{"games":{"1B":0,"2B":0,"3B":0,"C":115,"CF":0,"DH":3,"LF":0,"RF":0,"SS":0},"id":"lahman:bailepa01","name":"Patrick Bailey","pa":448,"positions":["C","DH"],"price":7,"profileId":"prepared:1762226eda767744c37e9e4fbfef7996893b9d467ed547137ff15e2c6f3422f8"},{"games":{"1B":0,"2B":24,"3B":0,"C":0,"CF":0,"DH":0,"LF":0,"RF":0,"SS":9},"id":"lahman:baldwbr01","name":"Brooks Baldwin","pa":121,"positions":["2B","DH"],"price":7,"profileId":"prepared:c26c49e34c83f4de6c3bfbbb5e782e456a3927a93f50d0489a353b23f44fa66f"},{"games":{"1B":0,"2B":0,"3B":36,"C":0,"CF":0,"DH":2,"LF":10,"RF":27,"SS":0},"id":"lahman:bargead01","name":"Addison Barger","pa":224,"positions":["3B","LF","RF","DH"],"price":6,"profileId":"prepared:bcf6af4f2e5180a5e6f71b1103b0b37d4701e8acd38ffd5079f4f4bc453787b5"},{"games":{"1B":0,"2B":2,"3B":0,"C":45,"CF":0,"DH":3,"LF":0,"RF":0,"SS":0},"id":"lahman:barneau01","name":"Austin Barnes","pa":156,"positions":["C","DH"],"price":5,"profileId":"prepared:a6ec8fced9838a8907205ad053c78b9d25e63d29667dfbbde50ddd902034e078"},{"games":{"1B":0,"2B":0,"3B":0,"C":31,"CF":0,"DH":0,"LF":0,"RF":0,"SS":0},"id":"lahman:barnhtu01","name":"Tucker Barnhart","pa":96,"positions":["C","DH"],"price":7,"profileId":"prepared:b204e0410e22af9a0a83e47536bfd2610f0b5511e77e57706b43d2f05cc7fb99"},{"games":{"1B":0,"2B":0,"3B":0,"C":69,"CF":0,"DH":11,"LF":0,"RF":0,"SS":0},"id":"lahman:bartjo01","name":"Joey Bart","pa":282,"positions":["C","DH"],"price":10,"profileId":"prepared:accecd129bbb0ec9d156d0fb814c194e858a7f2e425ec98bb3d5593ee5f848be"},{"games":{"1B":0,"2B":0,"3B":47,"C":0,"CF":0,"DH":0,"LF":0,"RF":0,"SS":0},"id":"lahman:batybr01","name":"Brett Baty","pa":171,"positions":["3B","DH"],"price":7,"profileId":"prepared:e2ef62ffe1a324fd5d99310fca03ce16cd8f55c6693675330f9a5751372c9bc4"},{"games":{"1B":76,"2B":0,"3B":0,"C":0,"CF":0,"DH":17,"LF":8,"RF":10,"SS":0},"id":"lahman:bauerja01","name":"Jake Bauers","pa":346,"positions":["1B","RF","DH"],"price":7,"profileId":"pre